id,term,categories,alternative spellings,notable_names,appeared_year,search_results_gscholar,source_1_citation,source_1_doi,source_2_citation,source_2_doi,source_3_citation,source_3_doi,definition,definition_url,parent_id,sibling_id_1,sibling_id_2,sibling_id_3
A7D48CC5,iPad Journalism,Medium,,,null,18,"Quinn, S., & Burum, I. (2015). MOJO: The mobile journalism handbook: How to make broadcast videos with an iPhone or iPad. Focal Press.",https://doi.org/10.4324/9781315740294,"Kraft, N., & Seely, N. (2015). Making mojos: How iPads are enhancing mobile journalism education. Journalism & Mass Communication Educator, 70(3), 220-234.",https://doi.org/10.1177/1077695815596493,"Bakker, P. (2012). Aggregation, content farms and Huffinization: The rise of low-pay and no-pay journalism. Journalism Practice, 6(5-6), 627-637.",https://doi.org/10.1080/17512786.2012.667266,,,,,,
8329F952,Iterative Journalism,Organization,,,null,43,"Baumgärtel, T. (2012). ‘Any Questions or Remarks?’Iterative Journalism Training in Cambodia. Asia Pacific Media Educator, 22(1), 89-100.",https://doi.org/10.1177%2F1326365X1202200110,"Picard, R. G. (2014). Twilight or new dawn of journalism? Evidence from the changing news ecosystem. Journalism Practice, 8(5), 488-498.",https://doi.org/10.1080/17512786.2014.905338,"Marconi, F. (2020). Newsmakers: Artificial Intelligence and the Future of Journalism. Columbia University Press.",,,,,,,
15FB04F7,Journalism for Justice,"Motivation, Audience, Beat",,,null,11,"Hackett, R. A. (2010). Journalism for peace and justice: towards a comparative analysis of media paradigms. Studies in Social Justice, 4(2), 179-198.",https://doi.org/10.26522/ssj.v4i2.1001,"Roberts, N. L. (1983). Journalism for Justice: Dorothy Day and the Catholic Worker. Journalism History, 10(1-2), 2-9.",,,,,,,,,
E9C272A7,Journalism of Care,Motivation,,,null,12,"Hayashi, K. (2017). A journalism of care. In: C. Peters & M. Broersma (Eds.), Rethinking Journalism Again. London: Routledge.",https://doi.org/10.4324/9781315716244,,https://medium.com/persist-reimagining-journalism/journalism-of-care-5dd04422d2d1,,,"""A journalism of care is a journalism that incorporates in its ethical foundation feminist values inherent to the ethic of care. In this respect, it is meant to be a critical review of the Anglo-American type of libertarian journalism ethics that still pervade a contemporary age marked by diverse societies; it calls for more inclu- siveness and integration of those who are forced to live as ‘social others’. Above all, a journalism of care problematizes how the right of free speech, which tends to be taken for granted in large parts of the world, is virtually irrelevant to many ‘social others’ in society, particularly those most in need of it. […] A journalism of care can also serve as a social institution that provides the public with a more comprehensive picture of the world, as well as binding people together who are otherwise increasingly spread out in modern mass society.""","Hayashi, K. (2017). A journalism of care. In: C. Peters & M. Broersma (Eds.), Rethinking Journalism Again. London: Routledge. https://doi.org/10.4324/9781315716244",,,,
523B88AD,Journalism of Fear,"Motivation, Organization",,,null,19,"Anderson, C. W. (2020). A journalism of fear. Journalism, 1464884920913383.",https://doi.org/10.1177/1464884920913383,,,,,"""Drawing on [Judith] Shklar, the journalism of fear contends that the worst of all evils is cruelty, and the purpose of journalism is to minimize that cruelty. […] The residual liberalism at the heart of modern journalistic practice – grounded in Shklar’s defense of toleration and her argument that cruelty must be put first – is a final, powerful incentive for today’s news organizations to adopt a ‘journalism of fear’.""","Anderson, C. W. (2020). ‘A journalism of fear.’ Journalism. https://doi.org/10.1177/1464884920913383",,,,
9B60BFE3,Journalism of Things,Technology,,,null,10,"Shere, A. R., Nurse, J. R., & Flechais, I. (2020). Security should be there by default: Investigating how journalists perceive and respond to risks from the Internet of Things.",,,,,,,,,,,
322C0F23,Labor Journalism,Beat,,,1946-06-08T05:00:00+0000',508,"Carlson, M. (2015). The robotic reporter: Automated journalism and the redefinition of labor, compositional forms, and journalistic authority. Digital journalism, 3(3), 416-431.",https://doi.org/10.1080/21670811.2014.976412,"Lowrey, W. (2006). Mapping the journalism–blogging relationship. Journalism, 7(4), 477-500.",https://doi.org/10.1177/1464884906068363,"Zelizer, B. (2008). Why memory's work on journalism does not reflect journalism's work on memory. Memory studies, 1(1), 79-87.",https://doi.org/10.1177/1750698007083891,,,,,,
BAC2B83C,Lay Journalism,Audience,,,null,56,"Miranda, G. F., Vercellesi, L., & Bruno, F. (2004). Information sources in biomedical science and medical journalism: methodological approaches and assessment. Pharmacological research, 50(3), 267-272.",https://doi.org/10.1016/j.phrs.2003.12.021,"Dunwoody, S. (1980). The science writing inner club: A communication link between science and the lay public. Science, Technology, & Human Values, 5(30), 14-22.",,"Deuze, M., & Witschge, T. (2016). What journalism becomes. In Rethinking Journalism Again (pp. 127-142). Routledge.",,,,,,,
D7A4B4B7,Legal Journalism,Beat,,,1962-09-22T05:00:00+0000',793,"Davey, C. J. (2012). The Future of Online Legal Journalism: The Courts Speak Only Through Their Opinions. ISJLP, 8, 575.",,"Goldstein, T. (1997). The Transformation of Legal Journalism. U. Cin. L. Rev., 66, 895.",,"Barnhurst, K. G., & Nerone, J. (2009). Journalism history. In The handbook of journalism studies (pp. 37-48). Routledge.",,,,,,,
A443EB63,Lifestyle Journalism,Beat,,,1987-03-15T05:00:00+0000',990,"Hanusch, F. (2012). Broadening the focus: The case for lifestyle journalism as a field of scholarly inquiry. Journalism practice, 6(1), 2-11.",https://doi.org/10.1080/17512786.2011.622895,"Kristensen, N. N., & From, U. (2012). Lifestyle journalism: Blurring boundaries. Journalism Practice, 6(1), 26-41.",https://doi.org/10.1080/17512786.2011.622898,"Fürsich, E. (2012). Lifestyle journalism as popular journalism: Strategies for evaluating its public role. Journalism Practice, 6(1), 12-25.",https://doi.org/10.1080/17512786.2011.622894,"""Lifestyle journalism can in overall terms be characterized by its roots in civil society and by its relations to advertising and typically by affiliations with “soft news” rather than “hard news.” At least three features, however, seem to make lifestyle a distinct journalistic field: the topics, the production processes, and the genres all seem to be central to the definition of lifestyle journalism.""","From, U. (2018, Sep). Lifestyle Journalism. Doi: 10.1093/acrefore/9780190228613.013.835",,,,
25339ABE,Liquid Journalism,Audience,,,null,603,"Deuze, M. (2008). The changing context of news work: Liquid journalism for a monitorial citizenry. International journal of Communication, 2, 18.",,"Widholm, A. (2016). Tracing online news in motion: Time and duration in the study of liquid journalism. Digital journalism, 4(1), 24-40.",https://doi.org/10.1080/21670811.2015.1096611,"Witschge, T., Anderson, C. W., Domingo, D., & Hermida, A. (Eds.). (2016). The SAGE handbook of digital journalism. Sage.",,"""‘Liquid journalism’ (Deuze, 2008; Karlsson, 2012) can generally be understood as journalism in a digital environment with no set or definitive borders. Liquidity, then, signals interconnectedness between different hubs and nodes, versionality in news stories and their positioning, multimodal storytelling, and blurring of boundaries between journalists and their audiences. Liquid digital journalism can both be produced in a centralized space, such as a website, or in a wider news ecology (Anderson, 2010) where different actors operate in decentralized spaces.""",https://uk.sagepub.com/en-gb/eur/the-sage-handbook-of-digital-journalism/book244110 (pp. 494-508),,,,
A019EF04,Literary Journalism,Motivation,,,1898-07-16T05:00:00+0000',11600,"Hartsock, J. C. (2000). A history of American literary journalism: The emergence of a modern narrative form. Univ of Massachusetts Press.",,"Sims, N. (2007). True stories: a century of literary journalism. Northwestern University Press.",,"Johnson, M. L. (1971). The new journalism. Lawrence, KS: University Press of Kansas.",,"""Literary journalism is a form of writing characterized by a particular aesthetic self-counsciousness more usually associated with literary creativity than with fact-driven journalism. [...] [It] aims to combine a desire to present information objectively with one to do it stylishly, therefore giving it a different kind of impact to the regular fare of newspapers.""","Bennett, B. (2008, 5 Jun). Literary Journalism. https://doi.org/10.1002/9781405186407.wbiecl028",,,,
3F1B30E4,Livestream Journalism,"Technology, Medium",,,null,3,"Jeppesen, S. (2016). Direct-Action Journalism: Resilience in grassroots autonomous media. Journal of Applied Journalism & Media Studies, 5(3), 383-403.",https://doi.org/10.1386/ajms.5.3.383_1,"Tunç, A. (2014). Can pomegranates replace penguins? Social media and the rise of citizen journalism in Turkey. Freedom House.",,"Quinn, S. (2011). Mojo-mobile journalism in the Asian Region. KAS.",,,,,,,
12E11799,Local Journalism,Location,,,1873-07-10T05:00:00+0000',5360,"Franklin, B. (Ed.). (2005). Local journalism and local media: Making the local news. Routledge.",,"Franklin, B., & Murphy, D. (Eds.). (1998). Making the local news: Local journalism in context. Psychology Press.",,"Anderson, C. W. (2013). Rebuilding the news: Metropolitan journalism in the digital age. Temple University.",,,,,,,
53927863,Locative Journalism,"Location, Technology",,,null,114,"Nyre, L., Bjørnestad, S., Tessem, B., & Øie, K. V. (2012). Locative journalism: Designing a location-dependent news medium for smartphones. Convergence, 18(3), 297-314.",https://doi.org/10.1177%2F1354856512441151,"Øie, K. V. (2013). Location sensitivity in locative journalism: an empirical study of experiences while producing locative journalism. Continuum, 27(4), 558-571.",https://doi.org/10.1080/10304312.2013.803307,"Øie, K. V. (2015). News narratives in locative journalism–rethinking news for the mobile phone. Journal of Media Practice, 16(3), 245-262.",https://doi.org/10.1080/14682753.2015.1116763,,,,,,
4BDAC3A4,Longform Journalism,Motivation,Long-Form Journalism,,2010-07-22T15:17:08+0000',415,"Hiippala, T. (2017). The multimodality of digital longform journalism. Digital journalism, 5(4), 420-442.",https://doi.org/10.1080/21670811.2016.1169197,"Le Masurier, M. (2015). What is slow journalism?. Journalism practice, 9(2), 138-152.",https://doi.org/10.1080/17512786.2014.916471,"Dowling, D., & Vogan, T. (2015). Can we “Snowfall” this? Digital longform and the race for the tablet market. Digital Journalism, 3(2), 209-224.",https://doi.org/10.1080/21670811.2014.930250,"""The concepts of literary journalism, long‐form journalism, and narrative journalism all refer to a journalistic genre that employs narrative storytelling techniques to report upon real‐world events and situations. [...] Whereas the label of long‐form journalism exclusively refers to written articles of considerable length—typically 2,000 words or more—that are published online or in print, the labels of narrative journalism and literary journalism are often used interchangeably, both covering a broad palette of journalistic products.""","Van Krieken, K. (2019, 29 Apr). Literary, Long-Form, or Narrative Journalism. https://doi.org/10.1002/9781118841570.iejs0135",,,,
82ADAB40,Longform Narrative Journalism,"Motivation, Time",,,2016-05-13T18:02:57+0000',37,"Lassila-Merisalo, M. (2014). Story First. Publishing Narrative Long-Form Journalism in Digital Environments. Journal of Magazine & New Media Research, 15(2), 1-15.",,"Le Masurier, M. (2015). What is slow journalism?. Journalism practice, 9(2), 138-152.",https://doi.org/10.1080/17512786.2014.916471,"Jacobson, S., Marino, J., & Gutsche Jr, R. E. (2016). The digital animation of literary journalism. Journalism, 17(4), 527-546.",https://doi.org/10.1177/1464884914568079,,,,,,
B7804876,Low-pay Journalism,Organization,,,null,2,"Bakker, P. (2012). Aggregation, content farms and Huffinization: The rise of low-pay and no-pay journalism. Journalism Practice, 6(5-6), 627-637.",https://doi.org/10.1080/17512786.2012.667266,"Bakker, P. (2011). New journalism 3.0-aggregation, content farms, and Huffinization: The rise of low-pay and no-pay journalism. In The Future of Journalism Conference 2011.",,"Everbach, T., & Flournoy, C. (2007). Women leave journalism for better pay, work conditions. Newspaper Research Journal, 28(3), 52-64.",https://doi.org/10.1177/073953290702800305,,,,,,
2D9A77A0,Magazine Journalism,Motivation,,,1964-04-06T05:00:00+0000',3470,"Holmes, T., & Nice, L. (2011). Magazine journalism. Sage.",,"Aitamurto, T. (2013). Balancing between open and closed: Co-creation in magazine journalism. Digital Journalism, 1(2), 229-251.",https://doi.org/10.1080/21670811.2012.750150,"Lepre, C., & Bleske, G. L. (2005). Little common ground for magazine editors and professors surveyed on journalism curriculum. Journalism & Mass Communication Educator, 60(2), 190-200.",https://doi.org/10.1177/107769580506000210,,,,,,
0BB4D743,Mainstream Journalism,"Motivation, Audience",,,1984-06-17T05:00:00+0000',7260,"Newman, N. (2009). The rise of social media and its impact on mainstream journalism.",,"Mabweazara, H. M. (2011). Between the newsroom and the pub: The mobile phone in the dynamics of everyday mainstream journalism practice in Zimbabwe. Journalism, 12(6), 692-707.",https://doi.org/10.1177/1464884911405468,"Atton, C. (2003). What isalternative'journalism?.",,,,,,,
1734B29E,Malayalam Journalism,Location,,Hermann Gundert,null,42,"Ahmed, S. A. (1986). The Language Press in India: A Case Study of Malayalam Newspapers. Gazette (Leiden, Netherlands), 38(1), 71-82.",,"Harikumar, M. S. (2008). News programming practices and readers content preferences: a study of malayalam newspapers.",,"Choondal, C. (1975). The missionaries and Malayalam journalism. Trichur.",,"""Malayalam journalism encompasses journalism published and broadcast in the Malayalam language. Modern Malayalam journalism can be traced to the publication of the Raajyasamaachaaram and the Pashchimodhayam under the direction of Hermann Gundert in June 1847.""",Malayalam journalism. https://en.wikipedia.org/wiki/Malayalam_journalism (02.12.19) ,,,,
C4728718,Mass Media Journalism,Medium,,,null,1490,"Hayashi, K. (2011). Journalism of “Women/Children” with Ethics of Care. Tokyo: Iwanami Shoten,.",https://harvard-yenching.org/features/journalism-justice-ethics-care,,,,,"""Traditionally, this scholarship has focused primarily on “mass media journalism”, which is rooted in liberalism and takes objectivity, neutrality, and impartiality as its core principles. […] In the name of objectivity, neutrality, and impartiality, “mass media journalism” is in fact inclined to confirm and reproduce existing power relations and unequal social structures.""","Hayashi, K. (2011). Journalism of “Women/Children” with Ethics of Care. Tokyo: Iwanami Shoten.",,,,
9A60A5FC,Measurable Journalism,Organization,,,null,93,"Carlson, M. (2018). Confronting measurable journalism.",https://doi.org/10.1080/21670811.2018.1445003,"Bromley, M., Tumber, H., & Zelizer, B. (2001). Journalism education.",,"Cohen, E. L. (2002). Online journalism as market-driven journalism. Journal of Broadcasting & Electronic Media, 46(4), 532-548.",https://doi.org/10.1207/s15506878jobem4604_3,,,,,,
33A75E31,Media Journalism,Beat,,,1964-05-29T05:00:00+0000',19100,"Fenton, N. (2010). New media, old news: Journalism and democracy in the digital age. Sage Publications.",,"Christians, C. G., Glasser, T., McQuail, D., Nordenstreng, K., & White, R. A. (2010). Normative theories of the media: Journalism in democratic societies. University of Illinois Press.",,"Hartley, J., & Hartley, J. (1996). Popular reality: Journalism, modernity, popular culture (p. 32). London: Arnold.",,,,,,,
EB98965E,Mediative Journalism,"Motivation, Audience",,,null,24,"Wetzstein, I. (2010). Mediated conflicts: Capacities and limitations of ‘mediative journalism’in public diplomacy processes. International Communication Gazette, 72(6), 503-520.",https://doi.org/10.1177%2F1748048510369215,,,,,"""The approach […] is to consider the concept of ‘mediative journalism’, which means that first of all links and differences between journalism and mediation as a conflict resolution tool have to be recognized. An explicit link between mediation and quality journalism has not been tested yet, although both show partly similar mindsets and attitudes concerning, for example, balance, the plurality of perspectives and critical reflection […].""","Wetzstein, I. (2010). Mediated Conflicts: Capacities and Limitations of ‘Mediative Journalism’ in Public Diplomacy Processes. International Communication Gazette 72(6): 503-520. https://doi.org/10.1177%2F1748048510369215",,,,
7B75A230,Medical Journalism,Beat,Medicine Journalism,,1856-10-18T05:00:00+0000',5470,"Levi, R. (2000). Medical journalism: Exposing fact, fiction, fraud. Iowa State University Press.",,"Larsson, A., Oxman, A. D., Carling, C., & Herrin, J. (2003). Medical messages in the media–barriers and solutions to improving medical journalism. Health expectations, 6(4), 323-331.",https://doi.org/10.1046/j.1369-7625.2003.00228.x,"Porter, R. (2019). The rise of medical journalism in Britain to 1800. In Medical journals and medical knowledge (pp. 6-28). Routledge.",,"""Medical journalism is news reporting (as opposed to peer-review publication) of medical news and features. Medical journalism is diverse, and reflects its audience.""",Medical journalism. https://en.wikipedia.org/wiki/Medical_journalism (02.12.19),,,,
5792EA3D,Mental health Journalism,Beat,,,2009-12-30T22:10:22+0000',184,"Holland, K.(2017). Digital media and models of biocommunicability in health journalism: Insights from the production and reception of mental health news. Australian Journalism Review, 39 (2), 67-77.",https://search.informit.com.au/documentSummary;dn=360410321082825;res=IELLCC,"Palpant, R. G., Steimnitz, R., Bornemann, T. H., & Hawkins, K. (2006). The Carter Center Mental Health Program: addressing the public health crisis in the field of mental health through policy change and stigma reduction. Preventing chronic disease, 3(2).",https://www.ncbi.nlm.nih.gov/pmc/articles/PMC1563952/,"Rosenthal, A. (2016, October). How social media affects mental health: Individual and community perspectives. In APHA 2016 Annual Meeting & Expo (Oct. 29-Nov. 2, 2016). American Public Health Association.",,,,,,,
63D89CC6,Metrics-driven Journalism,Technology,,,null,26,"Zamith, R. (2018). On metrics-driven homepages: Assessing the relationship between popularity and prominence. Journalism Studies, 19(8), 1116-1137.",https://doi.org/10.1080/1461670X.2016.1262215,"Nguyen, A. (2013). Online news audiences: The challenges of web metrics.",,"Poell, T., & Van Dijck, J. (2014). Social media and journalistic independence. Media independence: Working with freedom or working for free, 1, 181-201.",,,,,,,
197A67E0,Metropolitan Journalism,Location,,,1860-10-13T05:00:00+0000',816,"Anderson, C. W. (2013). Rebuilding the news: Metropolitan journalism in the digital age. Temple University.",,"Hanusch, F. (2015). A different breed altogether? Distinctions between local and metropolitan journalism cultures. Journalism Studies, 16(6), 816-833.",https://doi.org/10.1080/1461670X.2014.950880,"Anderson, C. (2009, April). Web production, news judgment, and emerging categories of online newswork in metropolitan journalism. In Article présenté à l’Online Journalism Symposium, à l’Université du Texas, Austin.",,,,,,,
AB21F838,Military Journalism,Beat,,,1865-07-13T05:00:00+0000',1230,"Tuosto, K. (2008). The"" Grunt Truth"" of Embedded Journalism: The New Media/Military Relationship. Stanford Journal of international relations, 10(1), 20-31.",,"Reese, S. D. (2004). Militarized journalism: Framing dissent in the Gulf Wars. In Reporting war (pp. 257-275). Routledge.",,"Cheng, S. (2008). Muckraking and stories untold: Ethnography meets journalism on trafficked women and the US military. Sexuality Research & Social Policy, 5(4), 6.",https://doi.org/10.1525/srsp.2008.5.4.6,,,,,,
930FFDB9,Millennial Journalism,Audience,,,null,25,"Turner, G. (2009). Millennial journalism. Journalism, 10(3), 390-392.",https://doi.org/10.1177/1464884909102581,"McNair, B. (2000). Journalism and democracy: a millennial audit. Journalism studies, 1(2), 197-211.",https://doi.org/10.1080/14616700050028208,"Bell, A. (2000). Dateline, deadline: journalism, language and the reshaping of time and place in the millennial world. Georgetown University round table on languages and linguistics, 46-66.",,,,,,,
D1A50767,Minority Journalism,"Beat, Motivation",,,1970-02-10T05:00:00+0000',379,"Kurpius, D. D. (2002). Sources and civic journalism: Changing patterns of reporting?. Journalism & Mass Communication Quarterly, 79(4), 853-866.",https://doi.org/10.1177/107769900207900406,"Deuze, M. (2005). What is journalism? Professional identity and ideology of journalists reconsidered. Journalism, 6(4), 442-464.",https://doi.org/10.1177/1464884905056815,"IRA, A., & Mt, R. (2001). Representing minorities: Canadian media and minority identities. Canadian Ethnic Studies/Etudes Ethniques au Canada, 33(3).",,"""When language differences exist, the dominant social group considers the news reports minority groups themselves produce as ""foreign-language journalism."" [...] At a minimum, the foreign-language press provides news of the homeland and its relationship with the host country. [...] The concept of minority journalism seems specific to the United States.""","Lind, R. A. (2008, 5 Jun). Minority Journalism. https://doi.org/10.1002/9781405186407.wbiecy001",,,,
570F48C4,Mobile Journalism,"Location, Medium",,,2020-01-21T09:23:15+0000',1650,"Quinn, S. (2011). Mojo-mobile journalism in the Asian Region. KAS.",,"Westlund, O. (2013). Mobile news: A review and model of journalism in an age of mobile media. Digital journalism, 1(1), 6-26.",https://doi.org/10.1080/21670811.2012.740273,"Väätäjä, H., Koponen, T., & Roto, V. (2009, September). Developing practical tools for user experience evaluation: a case from mobile news journalism. In European Conference on Cognitive Ergonomics: Designing beyond the Product---Understanding Activity and User Experience in Ubiquitous Environments (p. 23). VTT Technical Research Centre of Finland.",,"""Mobile journalism is an emerging form of new media storytelling where reporters use portable electronic devices with network connectivity to gather, edit and distribute news from his or her community.""","Mobile journalism. https://en.wikipedia.org/wiki/Mobile_journalism (05.12.19) (Richardson, Allissa. ""Mobile Journalism: A Model for the Future"". Diverse Issues in Higher Education. Cox, Matthews and Associates, Inc. Retrieved January 9, 2013.)",,,,
8A31261D,Muckraking Journalism,Motivation,,,1971-03-07T05:00:00+0000',1740,"Feldstein, M. (2006). A muckraking model: Investigative reporting cycles in American history. Harvard International Journal of Press/Politics, 11(2), 105-120.",https://doi.org/10.1177/1081180X06286780,"Cheng, S. (2008). Muckraking and stories untold: Ethnography meets journalism on trafficked women and the US military. Sexuality Research & Social Policy, 5(4), 6.",https://doi.org/10.1525/srsp.2008.5.4.6,"Schiffrin, A. (2019). Global muckraking. The International Encyclopedia of Journalism Studies, 1-5.",https://doi.org/10.1002/9781118841570.iejs0154,"""Als Muckraking (wörtlich: ""im Schmutz wühlen"") wird eine frühe Form des investigativen Journalismus bezeichnet, die vor allem zu Anfang des 20. Jahrhunderts in den USA populär wurde. Heutzutage wird Muckraking auch oft synonym für investigativen Journalismus im Allgemeinen verwendet, vor allem dort, wo er die Aufedckung von Korruption und kriminellen Machenschaften in Staat und Wirtschaft zum Ziel hat.""","Raetzsch, C. Muckraking. In: Deutscher Fachjournalisten-Verband (Hrsg.), Journalistische Genres (2017). 191-203.",,,,
B520205A,Multimedia Journalism,Medium,,,2000-03-15T05:00:00+0000',4260,"Deuze, M. (2004). What is multimedia journalism?. Journalism studies, 5(2), 139-152.",https://doi.org/10.1080/1461670042000211131,"Bull, A. (2015). Multimedia journalism: a practical guide. Routledge.",,"Bull, A. (2013). Brand journalism. Routledge.",,"""Multimedia journalism is the practice of contemporary journalism that distributes news content either using two or more media formats via the Internet, or disseminating news report via multiple media platforms. It is inseparably related to the media convergence of communication technologies, business integration of news industries, and editorial strategies of newsroom management.""","Multimedia journalism. https://en.wikipedia.org/wiki/Multimedia_journalism (05.12.19) (Deuze, Mark (2004). ""What is multimedia journalism?"". Journalism Studies. DOI: 10.1080/ 1461670042000211131: 140 – via Taylor & Francis Online.)",,,,
