id,term,categories,alternative spellings,notable_names,appeared_year,search_results_gscholar,source_1_citation,source_1_doi,source_2_citation,source_2_doi,source_3_citation,source_3_doi,definition,definition_url,parent_id,sibling_id_1,sibling_id_2,sibling_id_3
576D9280,Personality Journalism,Beat,,,1993-05-03T05:00:00+0000',354,"Forde, E. (2001). From polyglottism to branding: On the decline of personality journalism in the British music press. Journalism, 2(1), 23-43.",,"Petersen, A. H. (2011). Towards an industrial history of celebrity gossip: The National Enquirer, People Magazine and ‘personality journalism’in the 1970s. Celebrity Studies, 2(2), 131-149.",,"Petersen, A. H. (2014). Gossip Goes Mainstream: People Magazine, the National Enquirer, and the Rise of Personality Journalism. In When Private Talk Goes Public (pp. 225-247). Palgrave Macmillan, New York.",,,,,,,
3962AD81,Philanthro Journalism,Motivation,"Philantro-Journalism, Philanthrojournalism",,null,4,"Scott, M., Bunce, M., & Wright, K. (2017). Donor power and the news: The influence of foundation funding on international public service journalism. The International Journal of Press/Politics, 22(2), 163-184.",https://doi.org/10.1177/1940161217693394,"Bunce, M. (2016). Foundations, philanthropy and international journalism. Ethical Space: the international journal of communication ethics, 13(2/3), 6-15.",,"Bauer, M. W., Howard, S., Ramos, R., Jessica, Y., Massarani, L., & Amorim, L. (2013). Global science journalism report: working conditions & practices, professional ethos and future expectations. Science and Development Network.",,"""Philanthrojournalism (also known as not-for-profit journalism (NPJ), non-profit journalism or think tank journalism) is the practice of journalism as a non-profit organization. Like all non-profit organizations, NPJs depend on private donations or foundation grants to pay for operational expenses. This branch of journalism is not to be confused with other types of nonprofit news media organizations in the non-investigative field.""",Philanthrojournalism. https://en.wikipedia.org/wiki/Philanthrojournalism (05.12.19) ,,,,
DB60681E,Photojournalism,Technology,Photo Journalism,,1952-09-28T05:00:00+0000',29300,"Kobre, K. (2008). Photojournalism: The professionals' approach. Routledge.",https://doi.org/10.4324/9780080964041,"Lester, P. M. (2015). Photojournalism: An ethical approach. Routledge.",https://doi.org/10.4324/9781315682518,"Taylor, J. (1998). Body horror: Photojournalism, catastrophe, and war. NYU Press.",,"""Photojournalism means reporting visually. [...] The defining characteristic of photojournalism is visual portrayal, with contextualizing verbal information, of an event [...].""","Newton, J. H. (2013, 9 Jul). Photojournalism. https://doi.org/10.1002/9781405186407.wbiecp035.pub2",,,,
9E9DB070,Pink-Slime Journalism,Beat,,,null,10,"Cohen, N. S. (2015). From pink slips to pink slime: Transforming media labor in a digital age. The Communication Review, 18(2), 98-122.",https://doi.org/10.1080/10714421.2015.1031996,"Brennan, C. (2020). What is algorithmic “pink slime” journalism and why is it growing ahead of the US election?",https://www.deepnews.ai/what-is-algorithmic-pink-slime-journalism-and-why-is-it-growing-ahead-of-the-us-election/,,,,,,,,
DF3DC8E4,Podcast Journalism,Medium,,,null,53,"Huntsberger, M., & Stavitsky, A. (2006). The new “podagogy”: Incorporating podcasting into journalism education. Journalism & Mass Communication Educator, 61(4), 397-410.",https://doi.org/10.1177/107769580606100405,"Lindgren, M. (2016). Personal narrative journalism and podcasting. Radio Journal: International Studies in Broadcast & Audio Media, 14(1), 23-41.",https://doi.org/10.1386/rjao.14.1.23_1,"Bradshaw, P. (2013). The online journalism handbook: Skills to survive and thrive in the digital age. Routledge.",https://doi.org/10.4324/9781315834184,,,,,,
A7627FD4,Political Journalism,Beat,,,1875-04-11T05:00:00+0000',19100,"McNair, B. (2012). Journalism and democracy: An evaluation of the political public sphere. Routledge.",https://doi.org/10.4324/9780203021286,"Baym, G. (2005). The Daily Show: Discursive integration and the reinvention of political journalism. Political communication, 22(3), 259-276.",https://doi.org/10.1080/10584600591006492,"McNair, B. (2000). Journalism and democracy.",https://doi.org/10.4324/9780203021286,"""Political journalism constitutes one of the most prominent domains of journalism, and is essential for the functioning of democracy. Ideally, political journalism should function as an information provider, watchdog, and forum for political discussions, thereby helping citizens understand political matters and help prevent abuses of power.""","Strömbäck, J. & Shehata, A. (2018, Sep). Political Journalism. https://oxfordre.com/communication/view/10.1093/acrefore/9780190228613.001.0001/acrefore-9780190228613-e-859",,,,
389F7536,Pop Journalism,Beat,,"Jörg Fauser, Diedrich Diedrichsen",1978-01-29T05:00:00+0000',383,"Jones, S. (Ed.). (2002). Pop music and the press (Vol. 12). Temple University Press.",,"Wall, M., & El Zahed, S. (2015). Syrian citizen journalism: A pop-up news ecology in an authoritarian space. Digital Journalism, 3(5), 720-736.",https://doi.org/10.1080/21670811.2014.931722,"Wall, M. (2015). Change the space, change the practice? Re-imagining journalism education with the Pop-Up Newsroom. Journalism Practice, 9(2), 123-137.",https://doi.org/10.1080/17512786.2014.916482,"""It is defined as follows: ""pop journalism: an art of entertainment — without that invisible line, separating entertainment and arts so often from each other.""Neutert not only praised the onomatopoetic ""bombshell"" of the little word pop, but also the term’s inherent ""meaning variety, non-normativity, openness.""""",Pop Journalism. https://en.wikipedia.org/wiki/Pop_journalism (05.12.19),,,,
29DECA4D,Popular Journalism,Motivation,,,1964-01-26T05:00:00+0000',8950,"Gripsrud, J. (2000). Tabloidization, popular journalism and democracy. Tabloid tales: Global debates over media standards, 285-300.",,"Langer, J. (1998). Tabloid television: popular journalism and the"" other news"". Psychology Press.",,"Deuze, M. (2005). Popular journalism and professional ideology: tabloid reporters and editors speak out. Media, Culture & Society, 27(6), 861-882.",,"""‚Popular journalism‘ wurde als analytischer Begriff im anglo-amerikanischen Raum geprägt und von Peter Dahlgren und Colin Sparks (1996) in die medien- und kommunikationswissenschaftliche Diskussion eingeführt. Journalismus - und in erster Linie jener, der mit minimalen journalistischen Mitteln massenhafte Auflagen, große Reichweiten und damit maximalen unternehmerischen Profit erreicht - wird in diesem Zusammenhang kulturanalytisch auf der Basis des Cultural Studies-Ansatzes betrachtet. […] Der Begriff ‚Populärer Journalismus‘ ist in diesem Zusammenhang vielschichtig zu betrachten: Er impliziert den Zusammenhang zwischen Journalismus und Populärkultur, er thematisiert die Verstehensweise von Journalismus als Populärkultur und umfasst die Entwicklung, die Funktion und den Stellenwert von Journalismus in der Populärkultur.""","Renger, R. (2006) Populärer Journalismus. In: Hepp A., Winter R. (eds) Kultur — Medien — Macht. VS Verlag für Sozialwissenschaften. https://doi.org/10.1007/978-3-531-90668-3_17",,,,
FDE860DD,Positive Journalism,Motivation,,,1982-05-23T05:00:00+0000',229,"Gyldensted, C. (2011). Innovating news journalism through positive psychology.",,"McIntyre, K. E. (2015). Constructive journalism: The effects of positive emotions and solution information in news stories(Doctoral dissertation, The University of North Carolina at Chapel Hill).",,"McIntyre, K., & Gyldensted, C. (2017). Constructive journalism: An introduction and practical guide for applying positive psychology techniques to news production. The journal of media innovations, 4(2), 20-34.",http://dx.doi.org/10.5617/jomi.v4i2.2403,"""""Positive Journalism"" (positiver Journalismus) steht für einen bestimmten Zugang zur Berichterstattung, der auch als ""Constructive Journalism"" bezeichnet werden kann. […] Der Binsenweisheit der Medien ""Bad news are good news"" – ""schlechte Nachrichten sind gute Nachrichten"", weil sie beim Rezipienten die höchste Aufmerksamkeit generieren, soll die Nachrichtenrubrik ""Good News"" beziehungsweise ""Constructive News"" gegenübergestellt werden.""","Seitz, S. Positive Journalism. In: Deutscher Fachjournalisten-Verband (Hrsg.), Journalistische Genres (2017). 65-72.",,,,
1BB7EEC3,Post Journalism,Motivation,,,1892-01-06T05:00:00+0000',669,"Anderson, C. W., Bell, E., & Shirky, C. (2015). POST-INDUSTRIAL JOURNALISM: ADAPTING TO THE PRESENT. Geopolitics, History & International Relations, 7(2).",,"Nevins, A. (1922). The Evening Post: A Century of Journalism. Boni and Liveright.",,"BAUER, B. M. W., & Gregory, J. (2008). From journalism to corporate communication in post-war Britain. In Journalism, science and society (pp. 45-64). Routledge.",https://doi.org/10.4324/9780203942314,,,,,,
AA0256FF,Post-Industrial Journalism,Organization,,,null,932,"Anderson, C. W., Bell, E., & Shirky, C. (2015). POST-INDUSTRIAL JOURNALISM: ADAPTING TO THE PRESENT. Geopolitics, History & International Relations, 7(2).",,"Deuze, M., & Witschge, T. (2018). Beyond journalism: Theorizing the transformation of journalism. Journalism, 19(2), 165-181.",https://doi.org/10.1177/1464884916688550,"Creech, B., & Nadler, A. M. (2018). Post-industrial fog: Reconsidering innovation in visions of journalism’s future. Journalism, 19(2), 182-199.",https://doi.org/10.1177/1464884916689573,,,,,,
20251CC5,Precision Journalism,Motivation,,,1974-09-01T05:00:00+0000',2030,"Meyer, P. (2002). Precision journalism: A reporter's introduction to social science methods. Rowman & Littlefield Publishers.",,"Mosier, N. R., & Ahlgren, A. (1981). Credibility of precision journalism. Journalism Quarterly, 58(3), 375-518.",https://doi.org/10.1177/107769908105800304,"McCombs, M. E., Cole, R. R., Stevenson, R. L., & Shaw, D. L. (1981). Precision journalism: an emerging theory and technique of news reporting. Gazette (Leiden, Netherlands), 27(1), 21-34.",https://doi.org/10.1177/001654928102700103,"""Precision journalism is the use of social and behavioral science research methods to gather and analyze data, bringing a level of rigor to journalistic work beyond anecdotal evidence. [...] [It] is usually a subset of ""computer-assisted reporting,"" the catch-all term for anything from using the Internet for gathering information to creating interactive data graphics online. Another common term is ""database journalism"" [...].""","Doig, S. K. (2012, 19 Jun). Precision Journalism. https://doi.org/10.1002/9781405186407.wbiecp096.pub2",,,,
44B2F04D,Preventive Journalism,Motivation,,,2012-05-31T00:41:00+0000',116,"Erzikova, E., & Lowrey, W. (2014). Preventive journalism as a means of controlling regional media in Russia. Global Media and Communication, 10(1), 35-52.",https://doi.org/10.1177/1742766513513193,"McAlister, A. (1995). Behavioral journalism: Beyond the marketing model for health communication. American Journal of Health Promotion, 9(6), 417-420.",https://doi.org/10.4278/0890-1171-9.6.417,"Manoff, R. (1998). Role plays: Potential media roles in conflict prevention and management. Track Two, 7(4).",,"""Preventive journalism is a journalistic discipline that reports on urgent social problems at an early stage and on solutions proposed for these problems. It complements traditional investigative journalism and recognizes that journalism can alert government and society to problems before they become crises.""",Preventive Journalism. https://en.wikipedia.org/wiki/Preventive_journalism (05.12.19),,,,
D0FDD72E,Print Journalism,Medium,,,1965-07-25T05:00:00+0000',16900,"Franiuk, R., Seefelt, J. L., Cepress, S. L., & Vandello, J. A. (2008). Prevalence and effects of rape myths in print journalism: The Kobe Bryant case. Violence Against Women, 14(3), 287-309.",https://doi.org/10.1177/1077801207313971,"Keeble, R. (Ed.). (2005). Print journalism: a critical introduction. Routledge.",,"Jamieson, P., Jamieson, K. H., & Romer, D. (2003). The responsible reporting of suicide in print journalism. American Behavioral Scientist, 46(12), 1643-1660.",https://doi.org/10.1177/0002764203254620,,,,,,
CC2F3516,Privately Owned Journalism,Organization,,,null,3,"Skjerdal, T. S. (2011). Development journalism revived: The case of Ethiopia. Ecquid Novi: African Journalism Studies, 32(2), 58-74.",https://doi.org/10.1080/02560054.2011.578879,"Kasoma, T. (2009). Development reporting as a crumbling tower? Impact of brown envelope journalism on journalistic practice in Zambia and Ghana. Global Media Journal-African Edition, 3(1), 18-32.",,"Edeani, D. O. (1993). Role of development journalism in Nigeria's development. Gazette (Leiden, Netherlands), 52(2), 123-143.",https://doi.org/10.1177/001654929305200204,,,,,,
97CCCE11,Process Journalism,Organization,,,1984-12-09T05:00:00+0000',987,"Hausman, C. (1990). The decision-making process in journalism. Nelson-Hall.",,"McNair, B. (2000). Journalism and democracy.",https://doi.org/10.4324/9780203021286,"Tandoc Jr, E. C. (2014). Journalism is twerking? How web analytics is changing the process of gatekeeping. New media & society, 16(4), 559-575.",https://doi.org/10.1177/1461444814530541,,,,,,
FCB9BE43,Product Journalism,"Organization, Motivation",,,2013-10-31T12:35:00+0000',152,"Bull, A. (2013). Brand journalism. Routledge.",https://doi.org/10.4324/9780203083574,"Artwick, C. G. (2013). Reporters on Twitter: Product or service?. Digital Journalism, 1(2), 212-228.",https://doi.org/10.1080/21670811.2012.744555,"Tremayne, M., Weiss, A. S., & Alves, R. C. (2007). From product to service: The diffusion of dynamic content in online newspapers. Journalism & Mass Communication Quarterly, 84(4), 825-839.",https://doi.org/10.1177/107769900708400411,,,,,,
C27AC503,Public Journalism,"Motivation, Audience",,,1865-10-15T05:00:00+0000',10200,"Nip, J. Y. (2006). Exploring the second phase of public journalism. Journalism studies, 7(2), 212-236.",https://doi.org/10.1080/14616700500533528,"Glasser, T. L. (Ed.). (1999). The idea of public journalism. Guilford Press.",,"Haas, T. (2005). From “Public Journalism” to the “Public's Journalism”? Rhetoric and reality in the discourse on weblogs. Journalism Studies, 6(3), 387-396.",https://doi.org/10.1080/14616700500132073,"""Public journalism—also known as civic journalism—is a type of journalism that promotes the inclusion of private citizens in the news media, so that citizens can be included in public discussions and possible actions focused on solving societal problems.""","Bro, P. (2019, 29 Apr). Public or Civic Journalism. https://doi.org/10.1002/9781118841570.iejs0140",,,,
5F358AE5,Public Domain Journalism,Organization,,"Mike Ananny, Daniel Kreiss",null,29,"Ananny, M., & Kreiss, D. (2011). A new contract for the press: Copyright, public domain journalism, and self-governance in a digital age. Critical Studies in Media Communication, 28(4), 314-333.",https://doi.org/10.1080/15295036.2010.519339,"Flew, T., Spurgeon, C., Daniel, A., & Swift, A. (2012). The promise of computational journalism. Journalism Practice, 6(2), 157-171.",https://doi.org/10.1080/17512786.2011.616655,"Trench, B. (2007). 13 How the Internet changed science journalism. Journalism, science and society, 133.",,,,,,,
77AFED28,Public Interest Journalism,Motivation,,,1989-02-26T05:00:00+0000',1470,"Carvajal, M., García-Avilés, J. A., & González, J. L. (2012). Crowdfunding and non-profit media: The emergence of new models for public interest journalism. Journalism Practice, 6(5-6), 638-647.",https://doi.org/10.1080/17512786.2012.667267,"Iggers, J. (2018). Good news, bad news: Journalism ethics and the public interest. Routledge.",https://doi.org/10.4324/9780429500145,"Cook, F. L., Tyler, T. R., Goetz, E. G., Gordon, M. T., Protess, D., Leff, D. R., & Molotch, H. L. (1983). Media and agenda setting: Effects on the public, interest group leaders, policy makers, and policy. Public opinion quarterly, 47(1), 16-35.",https://doi.org/10.1086/268764,,,,,,
407581E6,Public Radio Journalism,"Medium, Organization",,,2016-10-27T09:00:18+0000',76,"Barnhurst, K. G. (2003). The makers of meaning: National Public Radio and the new long journalism, 1980-2000. Political Communication, 20(1), 1-22.",https://doi.org/10.1080/10584600390172374,"Crook, T. (2002). International radio journalism. Routledge.",https://doi.org/10.4324/9780203423233,"Lewis, J., Williams, A., & Franklin, B. (2008). A compromised fourth estate? UK news journalism, public relations and news sources. Journalism studies, 9(1), 1-20.",https://doi.org/10.1080/14616700701767974,"""American public radio journalism consists of the news and public affairs programs that can be heard on noncommerical radio stations and includes a variety of formats, from news magazines to public affairs programs to listener call-in programs. [...] Public radio journalism offers greater variety and depth than is typically provided on commercial stations, covering not only breaking news but also science and the arts.""","Shrikhande, S. (2009). Public Radio Journalism. 1148-1154. http://dx.doi.org/10.4135/9781412972048.n250",,,,
B863DD56,Public Service Journalism,Organization,,,1986-04-03T05:00:00+0000',1470,"Eide, M., & Knight, G. (1999). Public/private service: Service journalism and the problems of everyday life. European Journal of Communication, 14(4), 525-547.",https://doi.org/10.1177/0267323199014004004,"Wahl-Jorgensen, K., & Hanitzsch, T. (Eds.). (2009). The handbook of journalism studies. Routledge.",,"Beam, R. A., Brownlee, B. J., Weaver, D. H., & Di Cicco, D. T. (2009). Journalism and public service in troubled times. Journalism Studies, 10(6), 734-753.",https://doi.org/10.1080/14616700903274084,"""Public service journalism exists as part of a global media that has been referred to as a “mediapolis”: descriptively, a place, a communicative system where the world is constituted, and by means of which we learn about Others. [...] In sum, public service journalism consists of civil expression of information, accommodating a multiplicity of voices, the news conceived of as discursive rather than merely informational, and the public conceived of as critical interpreting citizens rather than informed readers.""","Harrison, J. (2019, Mar). Public Service Journalism. Doi: 10.1093/acrefore/9780190228613.013.867",,,,
683F6FE3,Public Television Journalism,Medium,,,1974-07-21T05:00:00+0000',49,"O'Toole, K. (2009). Public television journalism. In C. H. Sterling Encyclopedia of journalism (pp. 1155-1161). Thousand Oaks, CA: SAGE Publications, Inc.",http://sk.sagepub.com/reference/journalism/n321.xml,,,,,"""Public television news is an alternative to commercial news programming that positions the audience as information-seeking citizens rather than consumers. The public television model seeks to provide news that is important to a self-governing public regardless of its commercial viability in the electronic media marketplace.""",Public Television Journalism. http://dx.doi.org/10.4135/9781412972048.n321,,,,
CE349741,Punk Journalism,Beat,,,null,46,"Serazio, M. The irreverent life and uncompromising death of Deadspin: Sports blogging as punk journalism. Journalism, 1464884920987690.",https://doi.org/10.1177%2F1464884920987690,"Miller, A. (2016). Punk Journalism: searching for authenticity and identity in Robert Juan-Cantavella’s ‘El Dorado’ (Doctoral dissertation, University of British Columbia).",,"Triggs, T. (2006). Scissors and glue: punk fanzines and the creation of a DIY aesthetic. Journal of Design History, 19(1), 69-83.",https://doi.org/10.1093/jdh/epk006,,,,,,
69AF6A81,Quality Journalism,Motivation,,,1972-05-18T05:00:00+0000',10300,"Andrews, P. (2003). Is blogging journalism?. Nieman Reports, 57(3), 63.",,"Koch, J. (2008). Strategic paths and media management—a path dependency analysis of the German newspaper branch of high quality journalism. Schmalenbach Business Review, 60(1), 50-73.",,"Abramson, J. (2010). Sustaining quality journalism. Daedalus, 139(2), 39-44.",https://doi.org/10.1162/daed.2010.139.2.39,,,,,,
930A2D98,Quantified Journalism,Technology,,,null,8,"Anderson, C. W. (2011). Between creative and quantified audiences: Web metrics and changing patterns of newswork in local US newsrooms. Journalism, 12(5), 550-566.",https://doi.org/10.1177/1464884911402451,"Zamith, R. (2018). Quantified audiences in news production: A synthesis and research agenda. Digital Journalism, 6(4), 418-435.",https://doi.org/10.1080/21670811.2018.1444999,"Usher, N. (2013). Al Jazeera English online: Understanding web metrics and news production when a quantified audience is not a commodified audience. Digital Journalism, 1(3), 335-351.",https://doi.org/10.1080/21670811.2013.801690,,,,,,
2E4FA049,Radical Journalism,Motivation,,,1971-12-14T05:00:00+0000',1600,"Atton, C. (2002). News cultures and new social movements: Radical journalism and the mainstream media. Journalism Studies, 3(4), 491-505.",https://doi.org/10.1080/1461670022000019209,"Platon, S., & Deuze, M. (2003). Indymedia journalism: A radical way of making, selecting and sharing news?. Journalism, 4(3), 336-355.",https://doi.org/10.1177/14648849030043005,"Atton, C. (2003). What isalternative'journalism?.",,"""Activist and radical journalism, and radical media as its outlet, are defined as media and journalism that posit an alternative vision to the current state of affairs and its policies, priorities, and perspectives. [...] Activist and radical journalism can be further defined in terms of its relationship to mainstream journalism, pointing to an occasional overlap with alternative journalism.""","Siapera, E. & Farrell, S. (2019, 29 Apr). Activist and Radical Journalism. https://doi.org/10.1002/9781118841570.iejs0115",,,,
BF3F708B,Radio Journalism,Medium,,,1964-02-10T05:00:00+0000',5850,"Crook, T. (2002). International radio journalism. Routledge.",https://doi.org/10.4324/9780203423233,"Starkey, G., & Crisell, A. (2009). Radio journalism. Sage.",,"Chantler, P., & Stewart, P. (2013). Basic radio journalism. CRC Press.",,,,,,,
3FB93FC1,Real-time Journalism,Time,,,2019-08-20T10:00:04+0000',139,"Bruns, A. (2011). Gatekeeping, gatewatching, real-time feedback: new challenges for journalism. Brazilian Journalism Research, 7(2), 117-136.",https://doi.org/10.25200/BJR.v7n2.2011.355,"Hermida, A. (2013). # Journalism: Reconfiguring journalism research about Twitter, one tweet at a time. Digital journalism, 1(3), 295-313.",https://doi.org/10.1080/21670811.2013.808456,"Hermida, A. (2010). From TV to Twitter: How ambient news became ambient journalism. Media/Culture Journal, 13(2).",,,,,,,
36BF01C6,Reciprocal Journalism,Audience,,Seth Lewis,null,400,"Lewis, S. C., Holton, A. E., & Coddington, M. (2014). Reciprocal journalism: A concept of mutual exchange between journalists and audiences. Journalism Practice, 8(2), 229-241.",https://doi.org/10.1080/17512786.2013.859840,"Groshek, J., & Tandoc, E. (2016, July). The affordance effect: Gatekeeping and (non) reciprocal journalism on Twitter. In Proceedings of the 7th 2016 International Conference on Social Media & Society (p. 21). ACM.",https://doi.org/10.1145/2930971.2930993,"Borger, M., Van Hoof, A., & Sanders, J. (2016). Expecting reciprocity: Towards a model of the participants’ perspective on participatory journalism. New media & society, 18(5), 708-725.",https://doi.org/10.1177/1461444814545842,,,,,,
84225794,Reform Journalism,Motivation,,,1992-11-27T05:00:00+0000',648,"Clark, L. S. (2013). Cultivating the media activist: How critical media literacy and critical service learning can reform journalism education. Journalism, 14(7), 885-903.",https://doi.org/10.1177/1464884913478361,"Ward, S. J. (2009). Journalism ethics. The handbook of journalism studies, 295-309.",,"Rosen, J. (1995). Public journalism: A case for public scholarship. Change: The Magazine of Higher Learning, 27(3), 34-38.",https://doi.org/10.1080/00091383.1995.10544661,,,,,,
1F80EAC7,Relational Journalism,"Audience, Motivation",,,null,61,"Lewis, S. C. (2020). Lack of trust in the news media, institutional weakness, and relational journalism as a potential way forward. Journalism, 21(3), 345-348.",https://doi.org/10.1177%2F1464884918807597,,,,,,,,,,
71C183E0,Robot Journalism,Technology,,,2010-11-27T18:37:17+0000',731,"Clerwall, C. (2014). Enter the robot journalist: Users' perceptions of automated content. Journalism Practice, 8(5), 519-531.",https://doi.org/10.1080/17512786.2014.883116,"Kim, D., & Kim, S. (2017). Newspaper companies' determinants in adopting robot journalism. Technological Forecasting and Social Change, 117, 184-195.",https://doi.org/10.1016/j.techfore.2016.12.002,"Latar, N. L. (2015). The robot journalist in the age of social physics: The end of human journalism?. In The new world of transitioned media (pp. 65-80). Springer, Cham.",https://doi.org/10.1007/978-3-319-09009-2_6,"""Beim noch sehr jungen und sich derzeit ausdifferenzierenden Genre Roboterjournalismus handelt es sich […] 'um Software, die in Teilbereichen des Journalismus selbstständige Artikel und Berichte erstellt'.""","Bächle, T. C. und Rath-Wiggins, L. Robot Journalism. In: Deutscher Fachjournalisten-Verband (Hrsg.), Journalistische Genres (2017). 359-372.",,,,
